utterance,paraphrased,empathy,distance,similarity,grammatical_errors
"Nice! Thank you for your cooperation. Based on what you said, your childhood-self felt but did not express {} towards {}, but is it possible that your childhood-self is now expressing it toward others?","Nice! Thank you for your cooperation. Based on what you said, your childhood-self felt but did not express {} towards {}, but is it possible that your childhood-self is now expressing it toward others?",2.0,0,1.0,0
"Thank you, I really appreciate your cooperation. Did your childhood-self experience some serious illness/trauma when people abused them physically, sexually, or psychologically? I understand that thinking about difficult events can be uncomfortable at times, but I will help you deal with difficult emotions and give you some suggestions later.",have you experienced any serious illnesstrauma during your childhood - whether by way of physical sexual abuse or psychological abuse?,1.0,47,0.5605643391609192,2
"Thanks for telling me, I want to make sure I've understood correctly. I get the impression you are feeling {}, am I right? Please feel free to correct me if not.",please correct me if you do not understand,0.0,30,0.4212939739227295,1
"I'm so sorry, I'd love to understand better how you're feeling. Can you let me know how you feel by choosing the correct emotion from the list below? If so please let me know by selecting it:",i'm sorry i'd love to know more about how you feel can you tell me how you feel by selecting the appropriate emotion from the list below?,2.0,23,0.9005909562110901,2
"That's ok, thank you. I completely understand how you are feeling and it must be so hard. Did you notice that your childhood-self feels depressed or feels like being a failure from time to time?",i totally understand how you feel and it must be so hard did you notice that your childhood self feels depressed or feels like a failure from time to time?,2.0,13,0.9328198432922363,1
I'm so sorry to hear that. Was there something in particular that happened to cause you to feel this way? You can be open with me.,i'm so sorry for your pain,1.0,24,0.4097796082496643,1
"I'm sorry, that must have been hard. Would you say that it was a recent or a distant event, so that I can get a better picture? Either way, I hope it wasn't too traumatic for you.","I'm sorry, that must have been hard. Would you say that it was a recent or a distant event, so that I can get a better picture? Either way, I hope it wasn't too traumatic for you.",2.0,0,0.9999998807907104,0
"I'm very sorry that you are going through this. Have you recently attempted protocol 9 and found this reignited unmanageable emotions as a result of recent events? If this happened, I hope you didn't suffer too much from that exercise.","I'm very sorry that you are going through this. Have you recently attempted protocol 9 and found this reignited unmanageable emotions as a result of recent events? If this happened, I hope you didn't suffer too much from that exercise.",2.0,0,0.9999998807907104,0
"I understand it can be difficult. Did you attempt protocol 10 and, if so, did you have negative thoughts about the past which caused your mind to get stuck in that event? If this happened, I hope you didn't suffer too much from that exercise.",did you attempt protocol 10 and if so did you have negative thoughts about the past that caused your mind to get stuck in that event?,1.0,23,0.8806064128875732,1
"I am sorry that you are hurting, please bear with me while I try to investigate this further. To understand the reason why you are feeling this way in detail, I would now like to ask you some questions, if I may.",i'm sorry you are hurting please bear with me while i try to investigate this further,2.0,30,0.7719168663024902,2
"Thank you so much for sharing, I really appreciate it. I'm in tune with your emotion and we will understand how to overcome it. Would you say that {} has some negative attitude towards your childhood-self and treats your childhood-self in a bad manner?","Thank you so much for sharing, I really appreciate it. I'm in tune with your emotion and we will understand how to overcome it. Would you say that {} has some negative attitude towards your childhood-self and treats your childhood-self in a bad manner?",2.0,0,1.0,1
"Brilliant, I am delighted to hear that. However, my job is to teach people better handle negative emotions. Are you interested in understanding your negative emotions you've had in the past? In this case, could you please try to recall a time when you experienced difficult emotions?",brilliant i am delighted to hear that but my job is to teach people how to handle negative emotions do you want to understand your negative emotions you have had in the past?,2.0,29,0.9323433637619019,3
"I know it may be hard to overcome these difficult emotions. For your situation, I have worked out some useful tips that may help you to cope with these negative emotions. Are you willing to give it a go by any chance?",i know it can be hard to overcome these difficult emotions for your situation i have compiled some helpful tips that may help you cope with these negative emotions,2.0,22,0.9381788372993469,2
"You've done so well with this. How are you feeling after doing this, do you feel better or worse? I really hope I hope the protocol helped you, but feel free to tell me if that's not the case. ",do you feel better after doing this or worse?,0.0,35,0.5731674432754517,1
I'm glad the protocol was able to help. Would you like to continue with another suggestion? ,i'm happy the protocol helped do you want to continue with another suggestion?,1.0,8,0.905254602432251,1
"Sorry to hear you are feeling worse. I have other suggestions that could help, if you like. ",i'm sorry that you're feeling worse i can give you other suggestions,1.0,16,0.8788830041885376,2
"I apologize that given what you have informed me, I have not been able to identify any defense mechanism. Would you prefer to end the chat now or play it again, please?","I apologize that given what you have informed me, I have not been able to identify any defense mechanism. Would you prefer to end the chat now or play it again, please?",2.0,0,1.0,0
"Thanks, I see. I know this may be hard for you to discuss but your information has been very useful. Did you have a real fight with {}?",i know this may be difficult for you to discuss but your information has been very useful,2.0,14,0.6389672160148621,2
"Thank you for sharing, it helps me understand what you've been going through. Do you think that your childhood-self treated {} in an extremely friendly manner?","Thank you for sharing, it helps me understand what you've been going through. Do you think that your childhood-self treated {} in an extremely friendly manner?",2.0,0,0.9999998211860657,0
"Thank you, I know it isn't always easy, but anything you can tell me will help me to better understand your situation. Did your childhood-self have feelings or attitudes about {} similar to those they had about their primary caregivers (such as their parents and/or relatives)?","Thank you, I know it isn't always easy, but anything you can tell me will help me to better understand your situation. Did your childhood-self have feelings or attitudes about {} similar to those they had about their primary caregivers (such as their parents and/or relatives)?",2.0,0,1.0,0
"Great, thanks for answering that. I would really like to understand your emotion better and give you a hand. Has your childhood-self acted more like children towards {}? The more I understand, the more I can support you.","Great, thanks for answering that. I would really like to understand your emotion better and give you a hand. Has your childhood-self acted more like children towards {}? The more I understand, the more I can support you.",2.0,0,1.0000001192092896,0
"Great doing! Thanks for your trust so far. May I know, if this negative emotion was caused by someone else?","Great doing! Thanks for your trust so far. May I know, if this negative emotion was caused by someone else?",2.0,0,0.9999998807907104,1
I understand. Thanks for being open with me. Since your childhood-self has felt but not expressed {} towards {}. I would like to ask if your childhood-self has ever expressed it towards some other persons?,I understand. Thanks for being open with me. Since your childhood-self has felt but not expressed {} towards {}. I would like to ask if your childhood-self has ever expressed it towards some other persons?,2.0,0,1.0,0
"I appreciate you sharing this with me. I hope you don't mind me asking whether your childhood-self experienced some serious illness or bad things like physical or mental abuse when they were little? I understand that thinking about difficult events can be uncomfortable at times, but I will help you deal with difficult emotions and give you some suggestions later.",i appreciate you sharing this with me i hope you don't mind me asking whether your childhood self experienced some serious illness or bad things like physical or mental abuse when they were little? i understand that thinking about difficult events can be uncomfortable at times but i'll help you deal with difficult emotions and give you,2.0,12,0.9874834418296814,5
"Thank you for telling me how you feel. I have the impression that you are {} today, is this correct? Please correct me if I am wrong.","Thank you for telling me how you feel. I have the impression that you are {} today, is this correct? Please correct me if I am wrong.",2.0,0,1.0,0
"I'm so sorry, I'd love to understand better how you're feeling. Please give me a bit of help to make sure I do understand, you can select from this list of emotions the one that best describes what you're feeling: If so please let me know by selecting it:",please give me a little help to make sure i understand you can select the emotion that describes what you're feeling,2.0,34,0.7780196666717529,2
"Thank you for sharing this with me, I understand it can be difficult. I would like to ask you if your childhood-self feels depressed or feels like being a failure from time to time.",thank you for sharing it with me i understand it can be difficult i would like to ask you if your childhood-self feels depressed or feels like a failure from time to time,2.0,8,0.9846620559692383,4
"I'm so sorry to hear that. Was there something in particular that happened to cause you to feel this way? If so, I hope it wasn't too difficult for you.",i'm so sorry you felt this way what in particular caused you to feel this way?,2.0,21,0.7611405849456787,1
"I'm sorry, that must have been hard. Was the event that caused these feelings recent, or was it in the distant past? I hope you did not suffer too much from this event.",i'm sorry it must have been hard was the event that caused these feelings recent or was it in the distant past?,2.0,17,0.9085961580276489,1
"I'm very sorry that you are going through this. Did you try to complete protocol 9 and it resulted in reawakening some bad feelings due to things that happened in the recent past? If this happened, I hope you didn't suffer too much from that exercise.","I'm very sorry that you are going through this. Did you try to complete protocol 9 and it resulted in reawakening some bad feelings due to things that happened in the recent past? If this happened, I hope you didn't suffer too much from that exercise.",2.0,0,1.0000001192092896,1
"I understand it can be difficult. Have you recently attempted protocol 10 and found this reignited unmanageable emotions as a result of old events? If this happened, I hope you didn't suffer too much from that exercise.",i understand that sometimes it's hard to know have you recently tried protocol 10 and found this reignited unmanageable emotions as a result of old events? if this happened i hope you didn't suffer too much from this exercise,2.0,14,0.9665417671203613,3
"I am sorry that you are hurting, please bear with me while I try to investigate this further. If you don't mind I have a few more questions that will further help me understand the situation.",please bear with me while i try to investigate this further if you don't mind i have some more questions that will help me understand the situation,2.0,15,0.8432416915893555,3
"Thank you so much for sharing, I really appreciate it. I'm in tune with your emotion and we will understand how to overcome it. Do you think that {} holds some negative feelings toward your childhood-self?","Thank you so much for sharing, I really appreciate it. I'm in tune with your emotion and we will understand how to overcome it. Do you think that {} holds some negative feelings toward your childhood-self?",2.0,0,0.9999998807907104,1
"Brilliant! I am happy to hear that you are feeling great now. I am sorry to bother you, but my job is to help people better handle difficult emotions. Are you interested in understanding your negative emotions you've had in the past? Could I kindly ask you to recall a painful episode when you had difficult emotions?",brilliant i am happy to hear you're feeling great now i'm sorry to bother you but my job is to help people better deal with difficult emotions are you interested in understanding your negative emotions you've had in the past?,2.0,28,0.8531337380409241,4
"Emotions can be difficult to overcome. Based on what you've told me, I've selected some protocols that may be helpful to you. Would you be interested in trying any of them by any chance?",based on what you told me i have selected some protocols that may be helpful to you,1.0,23,0.43938565254211426,2
"You've done so well with this. Could you tell me if you are feeling better or worse after taking this protocol? I really hope I hope the protocol helped you, but feel free to tell me if that's not the case. ",would you tell me if you feel better after taking this protocol?,1.0,31,0.8254642486572266,1
I'm glad the protocol was able to help. Would you like to try something new now? ,i'm glad the protocol helped do you want to try something new now?,1.0,7,0.9455298781394958,1
"That's ok, not everyone feels better after the first one. How about we try another one and see how we get on with that one? ","That's ok, not everyone feels better after the first one. How about we try another one and see how we get on with that one? ",2.0,0,1.0,0
"I am sorry that based on the information given, I cannot detect any defense mechanism in your case. Would you like to play it again to give us more information or end the conversation here?","I am sorry that based on the information given, I cannot detect any defense mechanism in your case. Would you like to play it again to give us more information or end the conversation here?",2.0,0,1.0,0
Thanks for that. I know this may be hard for you to discuss but your information has been very useful. May I ask if you had a real fight with {}?,Thanks for that. I know this may be hard for you to discuss but your information has been very useful. May I ask if you had a real fight with {}?,2.0,0,1.0000001192092896,1
Thank you very much for this. It helps me understand what you've been going through.  Has your childhood-self been overly friendly towards {}?,Thank you very much for this. It helps me understand what you've been going through.  Has your childhood-self been overly friendly towards {}?,2.0,0,1.0,0
"Thank you, I know it isn't always easy, but anything you can tell me will help me to better understand your situation. Did your childhood-self feel toward {} similar to any of their primary caregivers (parents or relatives who took on most of them care during childhood)?","Thank you, I know it isn't always easy, but anything you can tell me will help me to better understand your situation. Did your childhood-self feel toward {} similar to any of their primary caregivers (parents or relatives who took on most of them care during childhood)?",2.0,0,1.0,0
"Thanks for your response. I would really like to understand your emotion better and give you a hand. With regard to {}, does your childhood-self behaviors seem more childlike or primitive?",i'd really like to understand your emotion and give you a hand,1.0,21,0.6459019184112549,1
Thanks for your trust and patience so far. You did an excellent job! Have your childhood-self interacted with anyone else that caused this negative emotion?,Thanks for your trust and patience so far. You did an excellent job! Have your childhood-self interacted with anyone else that caused this negative emotion?,2.0,0,0.9999999403953552,0
"I understand. Thanks for being open with me. Do you think that your childhood-self does not take out your {} towards {}, but towards another different person?","I understand. Thanks for being open with me. Do you think that your childhood-self does not take out your {} towards {}, but towards another different person?",2.0,0,0.9999998807907104,0
"Thank you, I really appreciate your cooperation. I know thinking about events where you suffered can be uncomfortable at times. But may I ask, has your childhood-self gone through some serious illness or maybe trauma, such as suffering from physical, sexual or psychological abuse?",i know it can be uncomfortable to think about what you suffered but is your childhood a traumatized person?,2.0,40,0.673103928565979,1
Thank you for that. Am I correct in thinking that you are feeling {} right now? Please feel free to correct me if not.,Thank you for that. Am I correct in thinking that you are feeling {} right now? Please feel free to correct me if not.,2.0,0,1.0,0
"My apologies. Please give me a bit of help to make sure I do understand, you can select from this list of emotions the one that best describes what you're feeling: If so please let me know by selecting it:",please give me a little help to make sure i understand you can select the emotion that best describes what you are feeling,2.0,25,0.7683582305908203,2
"Okay, thank you for that. Can you please tell me that if your childhood-self has felt depressed or like being a failure from time to time.","Okay, thank you for that. Can you please tell me that if your childhood-self has felt depressed or like being a failure from time to time.",2.0,0,1.0,1
I'm so sorry to hear that. Was there something in particular that happened to cause you to feel this way? Feel free to tell me openly.,i'm sorry to hear this was there anything in particular that caused you to feel this way? feel free to tell me openly,2.0,10,0.9445703029632568,2
"I'm sorry, that must have been hard. Was the event that caused these feelings recent, or was it in the distant past? Either way, I hope it wasn't too traumatic for you.",i'm sorry it must have been hard was the event that caused these feelings recent or was it from the distant past?,2.0,17,0.8714648485183716,1
"I'm very sorry that you are going through this. May I ask if you have tried protocol 9 to better understand the emotions you felt, but it was just too painful to get through? If this happened, I hope you didn't suffer too much from that exercise.","I'm very sorry that you are going through this. May I ask if you have tried protocol 9 to better understand the emotions you felt, but it was just too painful to get through? If this happened, I hope you didn't suffer too much from that exercise.",2.0,0,0.9999997615814209,0
"I understand it can be difficult. Were you recently attempting to move forward from this past event with protocol 10 and did the trauma you revisited become too difficult to deal with? If this happened, I hope you didn't suffer too much from that exercise.",if this happened to you i hope you didn't suffer too much from that exercise,2.0,35,0.6160625219345093,3
"I am sorry that you are hurting, please bear with me while I try to investigate this further. I would like to better understand what happened by asking some follow-up questions.",i'm sorry to see you hurt but please keep me as i try to investigate this more i'd like to understand what happened by asking some questions,2.0,16,0.7777796983718872,4
"Thank you so much for sharing, I really appreciate it. I'm in tune with your emotion and we will understand how to overcome it. Do you think that {} had negative feelings toward your childhood-self?","Thank you so much for sharing, I really appreciate it. I'm in tune with your emotion and we will understand how to overcome it. Do you think that {} had negative feelings toward your childhood-self?",2.0,0,1.0000001192092896,1
"Brilliant, I’m glad to hear that! I am sorry to bother you, but are you interested in understanding your negative emotions you've had in the past? If it's okay to proceed, can you please recall a painful episode when you had difficult emotions?","Brilliant, I’m glad to hear that! I am sorry to bother you, but are you interested in understanding your negative emotions you've had in the past? If it's okay to proceed, can you please recall a painful episode when you had difficult emotions?",2.0,0,1.0000001192092896,0
It is not easy to overcome difficult emotions. I'll give you some advice on how to deal with negative emotions based on what you’ve told me. Are you interested in trying any of them by any chance?,i'll give you some advice on how to deal with negative emotions based on what you told me are you interested in trying any of them by any chance?,2.0,12,0.8709832429885864,1
"You've done so well with this. How are you feeling after having taken the protocol? I really hope I hope the protocol helped you, but feel free to tell me if that's not the case. ",how do you feel after taking a new protocol?,0.0,32,0.7120966911315918,1
I'm glad the protocol was able to help. Would it make you feel even better to attempt other protocols? ,i'm glad the protocol helped you would it make you feel even better to try other protocols?,2.0,7,0.9573485851287842,2
"That's ok, not everyone feels better after the first one. Would you like to attempt another suggestion instead? ",maybe not everyone feels better after the first one,1.0,11,0.726894199848175,1
"I am sorry that I can't detect any defense mechanism based on your responses. Would like to play it again for more information or end the conversation? Both are okay, up to you.","I am sorry that I can't detect any defense mechanism based on your responses. Would like to play it again for more information or end the conversation? Both are okay, up to you.",2.0,0,1.0,0
"Alright, thank you. I know this may be hard for you to discuss but your information has been very useful. Can you let me know if you have ever had a real fight with {}?",i know it's going to be hard for you to discuss but your information has been very helpful can you let me know if you have had a real fight?,2.0,13,0.8795301914215088,2
"Thank you for sharing, it helps me understand what you've been going through. Has your childhood-self been overly friendly towards {}?",thank you for sharing it helps me understand what you have been through,1.0,13,0.634955644607544,1
"Okay, thanks. I know it isn't always easy, but anything you can tell me will help me to better understand your situation. I was wondering if the feelings/attitudes your childhood-self have about {} are kind of similar to any of their primary caregivers (such as parents or relatives who take the most of the responsibility of taking care of them during childhood)?","Okay, thanks. I know it isn't always easy, but anything you can tell me will help me to better understand your situation. I was wondering if the feelings/attitudes your childhood-self have about {} are kind of similar to any of their primary caregivers (such as parents or relatives who take the most of the responsibility of taking care of them during childhood)?",2.0,0,0.9999999403953552,0
"Thanks for providing me with your response, I would really like to give you a hand. If I may, has your childhood-self behaved really childlike or primitively with respect to {}?",thank you for your response i'd really like to give you a hand,1.0,24,0.5191215872764587,2
"Nice, thank you for your cooperation! May I ask if there are any other persons in this event that cause your childhood-self this negative emotion?",nice thank you for your cooperation may i ask if there are any others who cause you such a negative emotion?,2.0,13,0.8209317922592163,2
"I understand, thank you for letting me know. I know that your childhood-self felt {} about {} but not express it. Do you think that your childhood-self took out your negative emotions on another person?","I understand, thank you for letting me know. I know that your childhood-self felt {} about {} but not express it. Do you think that your childhood-self took out your negative emotions on another person?",2.0,0,0.9999998807907104,0
"I see, thanks for your response. To better understand your emotions. I would like to ask if your childhood-self have experienced some serious illness or maybe trauma when they suffered from physical, sexual or psychological abuse? I understand that thinking about difficult events from the past can be very uncomfortable, but I am here to help you deal with difficult emotions.",i understand that thinking about difficult events from the past can be uncomfortable but i'm here to help you deal with difficult emotions,2.0,42,0.7527181506156921,2
"Thank you for entrusting me by sharing how you feel. From what you have told me I would say that you are feeling {} right now, does that sound about right? Please feel free to correct me if not.",thank you for entrusting me by sharing how you feel,1.0,30,0.7610479593276978,1
I apologise sincerely. Could I ask that you choose from the list below the emotion that more accurately captures how you are feeling? If so please let me know by selecting it:,could i ask you to choose the emotion that represents more accurately how you feel?,1.0,24,0.7163176536560059,2
