utterance,paraphrased,empathy,distance,similarity,grammatical_errors
"Thanks, I appreciate your answer. I know it isn't always easy, but anything you can tell me will help me to better understand your situation. Are the feelings/attitudes your childhood-self embodied towards {} somehow related to any of their primary guardians (such as caregivers or parents who take the most responsibility about them when they were little)?","Thanks, I appreciate your answer. I know it isn't always easy, but anything you can tell me will help me to better understand your situation. Are the feelings/attitudes your childhood-self embodied towards {} somehow related to any of their primary guardians (such as caregivers or parents who take the most responsibility about them when they were little)?",2.0,0,1.0000001192092896,0
"Alright, thank you for that. I would really like to understand your emotion better and give you a hand.  Do you think that your childhood-self behaved more childlike or primitive when dealing with {}?","Alright, thank you for that. I would really like to understand your emotion better and give you a hand.  Do you think that your childhood-self behaved more childlike or primitive when dealing with {}?",2.0,0,1.0,0
"Thank you for telling me that. If it's okay with you, may I ask, is there any person who made your childhood-self have this kind of negative feelings?",if it's okay with you i can ask you has anyone made your childhood self have this kind of negative feelings?,2.0,18,0.8935356736183167,3
"Okay, thank you for your response. Considering your childhood-self has felt {} about {}, but not expressed it. Is it possible that your childhood-self expresses it to someone else?","Okay, thank you for your response. Considering your childhood-self has felt {} about {}, but not expressed it. Is it possible that your childhood-self expresses it to someone else?",2.0,0,1.0,0
"Thank you, I really appreciate your cooperation. I completely feel you, thinking about events where you suffered may hurt sometimes. Has your childhood-self ever suffer from some serious illness or trauma that people abused them physically, sexually, or psychologically?","Thank you, I really appreciate your cooperation. I completely feel you, thinking about events where you suffered may hurt sometimes. Has your childhood-self ever suffer from some serious illness or trauma that people abused them physically, sexually, or psychologically?",2.0,0,0.9999999403953552,0
"Thank you for sharing. From what you've told me, it sounds like you're feeling {}, is this right? Please feel free to correct me if not.","Thank you for sharing. From what you've told me, it sounds like you're feeling {}, is this right? Please feel free to correct me if not.",2.0,0,1.0,0
"I am sorry, perhaps I misunderstood how you are feeling. If you could, please tell me how you're feeling by selecting from the list below: If so please let me know by selecting it:",if you could tell me how you feel by selecting from the list below,1.0,25,0.6909164190292358,1
"I understand, thank you for taking the time to answer that. It must be very difficult for you right now. I completely understand how you feel. Does your childhood-self sometimes feel depressed or like a failure?",i understand thank you for taking the time to answer that it must be very hard for you right now i completely understand how you feel,2.0,17,0.6500478982925415,2
"Thank you for letting me know, I am terribly sorry you are feeling that way. Can you tell me if a specific event may have caused that? If so, I hope it wasn't too difficult for you.",thank you for telling me i am terribly sorry that you are feeling this way can you tell me if a specific event may have caused that?,2.0,18,0.902397871017456,2
"You must be hurting right now. Do you think something recent caused this feeling, or was it something more distant? Either way, I hope it wasn't too traumatic for you.",is there something recently that caused this feeling or was it something more distant?,0.0,22,0.6140111684799194,1
"Thank you for being so open, I'm trying to determine the best way to help and know how hard it is to revisit recent painful events. Have you tried protocol 9, and did it cause you to feel any negative emotions? If this happened, I hope you didn't suffer too much from that exercise.","Thank you for being so open, I'm trying to determine the best way to help and know how hard it is to revisit recent painful events. Have you tried protocol 9, and did it cause you to feel any negative emotions? If this happened, I hope you didn't suffer too much from that exercise.",2.0,0,0.9999999403953552,0
"I'm very sorry that you are going through this. Did you try to complete protocol 10 and it resulted in reawakening some bad feelings due to things that happened in the past? If this happened, I hope you didn't suffer too much from that exercise.","I'm very sorry that you are going through this. Did you try to complete protocol 10 and it resulted in reawakening some bad feelings due to things that happened in the past? If this happened, I hope you didn't suffer too much from that exercise.",2.0,0,1.0000001192092896,1
"I am sorry that you are hurting, please bear with me while I try to investigate this further. What I'd like to do now is ask a few questions about what's going on just so that I can better understand what's happening.",i'm sorry you hurt please bear with me while i try to investigate this further what i'd like to do right now is ask a few questions to understand what's going on,2.0,21,0.8721303939819336,4
"It is nice of you to share that with me. I'm in tune with your emotion and we will understand how to overcome it. If you agree, I would like to ask you some more questions so I can better understand your situation. Have you noticed that {} has a negative attitude toward your childhood-self?",it is nice of you to share this with me i am in tune with your emotion and we will understand how to overcome it if you agree i'd like to ask you a few more questions to better understand your situation has,2.0,27,0.7985202670097351,5
"Brilliant, I’m glad to hear that you sound positive now! But it is also good to learn how to handle negative emotions. In order to proceed our conversation, would you mind recalling a painful episode when you had difficult feelings? ",brilliant i'm glad to hear you sound good now but it's also good to learn how to handle negative emotions,2.0,27,0.8055794835090637,3
"I feel sorry for your situation. I understand that it might not be easy to overcome difficult emotions. For more help, I've put together some tips on how to cope with negative feelings that you might find useful. Can I ask if you would be interested in trying with some of them by any chance?",i feel sorry for your situation i understand that it might not be easy to overcome difficult emotions for more help i've compiled some tips on how to cope with negative feelings that you might find useful,2.0,27,0.9034750461578369,3
"Thank you, I hope that was helpful to you. Now that the protocol is finished, do you feel any differently to how you felt beforehand? I really hope I hope the protocol helped you, but feel free to tell me if that's not the case. ",i really hope the protocol helped you but feel free to tell me if that isn't the case,2.0,32,0.7945799231529236,1
"I'm so glad you're feeling better, I think this is great! Would you like to try something new now? ",i'm so glad you feel better i think it's great,2.0,16,0.7240716814994812,2
"Not every protocol works for everyone, and that's okay, I would recommend not giving up and trying again. Would you like to try again with a different one? ","Not every protocol works for everyone, and that's okay, I would recommend not giving up and trying again. Would you like to try again with a different one? ",2.0,0,1.0,0
"My apologies, but I am unable to detect any defense mechanism from what you’ve told me. Would you prefer to end the conversation now or play it again?",i can't detect a defense mechanism from what you told me do you prefer to end this conversation now or play it again?,1.0,12,0.9012429714202881,1
"I understand, thanks. I know this may be hard for you to discuss but your information has been very useful. Have you have ever fought with {}?",i know that this may be hard for you to discuss but your information has been very helpful have you ever fought with?,2.0,10,0.8828611373901367,2
"Okay, thank you for your honesty. I understand your childhood-self felt negative emotions towards {}, but has it happened that your childhood-self treated {} in an excessively friendly manner?","Okay, thank you for your honesty. I understand your childhood-self felt negative emotions towards {}, but has it happened that your childhood-self treated {} in an excessively friendly manner?",2.0,0,0.9999998807907104,0
"Thank you, I know it isn't always easy, but anything you can tell me will help me to better understand your situation. Is the feelings/attitudes your childhood-self have about {} similar to any of their primary caregivers (such as parents or relatives who take the most of the responsibility of taking care of them when they were little)?","Thank you, I know it isn't always easy, but anything you can tell me will help me to better understand your situation. Is the feelings/attitudes your childhood-self have about {} similar to any of their primary caregivers (such as parents or relatives who take the most of the responsibility of taking care of them when they were little)?",2.0,0,0.9999998807907104,0
"Alright, thank you for that. I would really like to understand your emotion better and give you a hand. Then I would like to ask if your childhood-self behaviors are, to some extent, more childlike or primitive with respect to {}?",i would really like to understand your emotion better and give you a hand then i would like to ask you if your childhood-self behaviors are to some extent more childlike or primitive with ,2.0,15,0.9385135173797607,2
"Wonderful, thanks for your sharing. I understand it may be difficult, but I would greatly appreciate it if you could share this with me. May I ask, are your childhood-self's current feelings due to something that happened with a specific person?","Wonderful, thanks for your sharing. I understand it may be difficult, but I would greatly appreciate it if you could share this with me. May I ask, are your childhood-self's current feelings due to something that happened with a specific person?",2.0,0,1.0,0
"Thank you for opening up to me. I'd like to help you understand your negative thoughts. From what you said, your childhood-self has felt but not expressed {} towards {}, but has your childhood-self taken it out on another person?",thank you for being open to me i would like to help you understand your negative thoughts,2.0,31,0.6469069719314575,3
"It can be uncomfortable to think about difficult events that have occurred. But I am here for you to understand your situation better, I hope you don’t mind me asking if your childhood-self has ever experience some serious illness or trauma, for example, was your childhood-self ever abused physically, sexually, or psychologically by others?",i am here to understand your situation better i hope you dont mind asking me if your childhood-self has ever experienced some serious illness or trauma?,2.0,36,0.7818601131439209,3
"Thank you for opening up to me. From what you have told me I would say that you are feeling {} right now, does that sound about right? Please feel free to correct me if not.",thank you for opening up to me,1.0,30,0.5207085609436035,1
"I am sorry, perhaps I misunderstood how you are feeling. Please give me a bit of help to make sure I do understand, you can select from this list of emotions the one that best describes what you're feeling:",please give me a bit of help to make sure i do understand you can select from this list of emotions the one that best describes what you're feeling,2.0,14,0.8572630882263184,2
"Thank you for letting me know. I completely understand how you are feeling and it must be so hard. Did your childhood-self feel pessimistic, depressed or even like a failure from time to time?",thank you for letting me know i totally understand how you feel and it must be so hard,2.0,22,0.6536409854888916,2
"I'm sorry to hear you aren't feeling well. So that I can help you better, could you tell me if a specific event caused you to feel this way? You can be open with me.",please tell me if a certain event or life experience caused you to feel this way please be open with me,2.0,25,0.6945589780807495,1
You must be hurting right now. Would you say that it was a recent or distant event (or events) that caused this emotion? I hope you did not suffer too much from this event.,i hope you didn't suffer too much,1.0,29,0.5590693950653076,1
"Thank you for being so open, I'm trying to determine the best way to help and know how hard it is to revisit recent painful events. Did you notice if there were unbearable emotions that came up from attempting protocol 9 (if you have attempted it), due to recent events? If this happened, I hope you didn't suffer too much from that exercise.","Thank you for being so open, I'm trying to determine the best way to help and know how hard it is to revisit recent painful events. Did you notice if there were unbearable emotions that came up from attempting protocol 9 (if you have attempted it), due to recent events? If this happened, I hope you didn't suffer too much from that exercise.",2.0,0,1.0,0
"I'm very sorry that you are going through this. Did you notice if there were unbearable emotions that came up from attempting protocol 10 (if you have attempted it), due to past events? If this happened, I hope you didn't suffer too much from that exercise.",do you notice any unbearable emotions that came up from attempting protocol 10? if this happened i hope you didn't suffer too much from that exercise,2.0,27,0.9238624572753906,3
"Thank you, I am sorry you're struggling right now and want to help. What I'd like to do now is ask a few questions about what's going on just so that I can better understand what's happening.",thank you i'm sorry you're struggling right now and i want to help,1.0,30,0.7031816244125366,3
I appreciate you sharing that with me. I'm in tune with your emotion and we will understand how to overcome it. Do you feel like {} had negative feelings toward your childhood-self?,I appreciate you sharing that with me. I'm in tune with your emotion and we will understand how to overcome it. Do you feel like {} had negative feelings toward your childhood-self?,2.0,0,1.0,1
"Brilliant! I am glad to hear that you are now feeling great. But because my job is to help people better handle difficult emotions, I have an unusual favor to ask in order to proceed the conversation. Can I ask you to recall a painful experience you had in the past?",brilliant i am glad you are feeling great but because of my job i have an unusual favor to ask in order to continue the conversation can i ask you to remember a painful experience you had in the past?,2.0,23,0.9148669838905334,4
Emotions can be difficult to overcome. I have collected some helpful tips to cope with negative feelings. Would you be interested in trying any of them?,i have collected some helpful tips on how to deal with negative feelings,1.0,20,0.7626516819000244,1
"You've done so well with this. Has this protocol made you feel better or worse? I really hope I hope the protocol helped you, but feel free to tell me if that's not the case. ",how did this protocol help you feel?,0.0,32,0.7396185398101807,1
"I'm so glad you're feeling better, I think this is great! Would you like to try something new? ",i'm so glad you're feeling better i think it's good,2.0,13,0.74187833070755,2
"I am sorry to hear that you feel worse. I have other suggestions that could help, if you like. ",i'm sorry to hear you feel worse i can make some suggestions if you want to help,2.0,14,0.9096869230270386,2
I am sorry that I cannot detect any defense mechanism from what you’ve told me. Would you like to end our conversation here or are you more willing to try again?,i'm sorry that i can't detect any defense mechanism from what you told me,1.0,22,0.7558197975158691,2
"Thank you, that's fine. I know this may be hard for you to discuss but your information has been very useful. Have you ever had a real fight with {}?",i know it may be hard for you to discuss but your information has been very useful,2.0,16,0.6256385445594788,2
"Thanks for sharing this, it's really helpful. Would you consider your childhood-self to have been excessively friendly to {}?",would you consider your childhood self to be overly friendly?,0.0,16,0.7895779609680176,1
"Thank you, I know it isn't always easy, but anything you can tell me will help me to better understand your situation. Is your childhood-self's feelings towards {} same to any of their parents/relatives who took care of you primarily when they were little?","Thank you, I know it isn't always easy, but anything you can tell me will help me to better understand your situation. Is your childhood-self's feelings towards {} same to any of their parents/relatives who took care of you primarily when they were little?",2.0,0,0.9999999403953552,0
"Alright, thank you for that. I would really like to understand your emotion better and give you a hand. Would you mind sharing if your childhood-self behaviors become more childlike with respect to {}?","Alright, thank you for that. I would really like to understand your emotion better and give you a hand. Would you mind sharing if your childhood-self behaviors become more childlike with respect to {}?",2.0,0,1.0,0
"Okay, thanks for that. Do you mind telling if this negative emotion has something to do with your childhood-self's interaction with someone else? Maybe there are more than one person?",can you tell if this negative emotion has something to do with your childhood's interaction with someone else? maybe there is more than one person?,1.0,10,0.9276731610298157,2
"I understand, thank you for letting me know. So your childhood-self felt {} towards {} but has not expressed it. Then I was wondering if it's possible that your childhood-self is now expressing it towards someone else?","I understand, thank you for letting me know. So your childhood-self felt {} towards {} but has not expressed it. Then I was wondering if it's possible that your childhood-self is now expressing it towards someone else?",2.0,0,1.0000001192092896,0
"Thank you, I really appreciate your cooperation. Has your childhood-self ever experienced some serious illness/ trauma that people abused them physically, sexually, psychologically? I understand that thinking about difficult events can be uncomfortable at times, but I will help you deal with difficult emotions and give you some suggestions later.",i understand that thinking about difficult events can be uncomfortable at times but i will help you deal with difficult emotions and i will give you some suggestions later,2.0,29,0.5890607237815857,3
"Thank you for your openness. I think that perhaps you are feeling {}, do you think that's true? Please feel free to correct me if not.","Thank you for your openness. I think that perhaps you are feeling {}, do you think that's true? Please feel free to correct me if not.",2.0,0,1.0,0
"I apologise, I must have misunderstood. Can you let me know how you feel by choosing the correct emotion from the list below? If so please let me know by selecting it:",i apologise for not being aware of this fact can you let me know how you feel by selecting the right emotion from the list below?,2.0,21,0.858181357383728,2
"It must be so hard for you to feel the way you do. I totally understand how you feel. When you look back on your childhood-self, do you think your childhood-self feels depressed or feels like a failure?",if you look back at the past or look at your childhood yourself do you think your childhood self feels depressed or like a failure?,1.0,27,0.8438687324523926,1
"Sorry to hear that, I can relate. Can you tell me if this was caused by a specific event/s? If so, I hope it wasn't too difficult for you.","Sorry to hear that, I can relate. Can you tell me if this was caused by a specific event/s? If so, I hope it wasn't too difficult for you.",2.0,0,1.0000001192092896,0
"You must be hurting right now. Would you say that it was a recent or distant event (or events) that caused this emotion? Either way, I hope it wasn't too traumatic for you.",would you say that it was a recent or distant event or events that caused this emotion? either way i hope it wasn't too traumatic for you,2.0,13,0.8859825134277344,3
"I'm very sorry that you are going through this. Have you tried going through protocol 9 recently and, as a result, had uncontrolled emotions that were rekindled by things that happened in the recent past? If this happened, I hope you didn't suffer too much from that exercise.",i'm sorry you're going through this have you tried protocol 9 recently and as a result had uncontrolled emotions that were rekindled by things that happened in the recent past? if this happened i hope you don't suffer too much from,2.0,17,0.9448316693305969,3
"I'm very sorry that you are going through this. Did you attempt protocol 10 and, if so, did you have negative thoughts about the past which caused your mind to get stuck in that event? If this happened, I hope you didn't suffer too much from that exercise.",did you attempt protocol 10 and if so did you have negative thoughts about the past that caused your mind to get stuck in this event? if this happened i hope you didn't suffer too much from that exercise,2.0,18,0.958576500415802,3
"I am sorry that you are hurting, please bear with me while I try to investigate this further. If it's okay, I'm going to ask a few questions to get a better understanding of what you're going through.",i'm sorry you hurt please bear with me as i try to investigate this further if it's okay i'm going to ask you a few questions so i can understand what you're going through,2.0,19,0.9051535725593567,4
"Your sharing is greatly appreciated. I'm in tune with your emotion and we will understand how to overcome it. If you agree, I would like to ask some more questions so I can better understand your situation. Do you think that {} has a negative attitude towards your childhood-self?",i'm in tune with your emotion and we'll understand how to overcome it if you agree i'd like to ask you more questions so i can better understand your situation,2.0,28,0.7481400966644287,4
"That's wonderful, I'm glad to hear you're feeling great! But my job is to help people better handle difficult emotions, so I have an unusual favor to ask in order to proceed the conversation. Could you please try to recall a painful episode when you had difficult emotions in the past, if it is ok with you?",i'm glad you're feeling great but my job is to help people better handle difficult emotions so i have an unusual favor to ask in order to continue the conversation could you please try to remember a painful episode in the,2.0,25,0.9418917894363403,3
"Overcoming difficult emotions is not easy. For more help, I've put together some tips on how to deal with negative emotions that may be useful to you. Are you interested in trying some of these?",for more help i have put together some tips on how to deal with negative emotions that may be useful to you,1.0,18,0.8589711785316467,2
"You've done so well with this. How do you feel after completing this protocol, better or worse? I really hope I hope the protocol helped you, but feel free to tell me if that's not the case. ",how do you feel after completing this protocol better or worse?,0.0,28,0.8054059743881226,1
"OK, that's great to hear. Would it make you feel even better to attempt another protocol? ",is it good to hear about this would it make you feel even better to try another protocol?,2.0,8,0.9011005759239197,1
I am sorry to hear that you feel worse. Could I give another suggestion for you to try? ,i'm sorry to hear you're feeling worse can i give you another suggestion?,1.0,13,0.9144419431686401,2
I am sorry that I cannot identify any defense mechanism from what you told me. Would you like to give me one more chance to play it again or end the conversation now?,i'm sorry to learn that i cannot identify any defense mechanism from what you told me,2.0,23,0.7995427846908569,2
"Ok, I see. Thank you for your trust so far. I know this may be hard for you to discuss but your information has been very useful. Have you ever had a real fight with {}?","Ok, I see. Thank you for your trust so far. I know this may be hard for you to discuss but your information has been very useful. Have you ever had a real fight with {}?",2.0,0,1.0,1
"That was really useful, thank you. Now, I would like to know if your childhood-self ever reacted excessively friendly towards {}?","That was really useful, thank you. Now, I would like to know if your childhood-self ever reacted excessively friendly towards {}?",2.0,0,1.0000001192092896,0
"Thank you for answering. I know it isn't always easy, but anything you can tell me will help me to better understand your situation. Would you say that your childhood-self's feelings/attitudes towards {} are similar to those of their primary caregivers (such as your parents or relatives who took most of the responsibility to care for them during childhood)?",i know it's not always easy but anything you can tell me will help me to better understand your situation,2.0,44,0.5615520477294922,1
